{
  "schema_version": "1.10.0",
  "artifact_id": "psr-lpcr-anthropic-smoke-0001",
  "workspace": "ws_governance",
  "brand_ref": "brand_nabcor",
  "created_at": "2026-07-20T00:24:21.409Z",
  "live_call_request_ref": "lpcr-anthropic-smoke-0001",
  "live_call_request_digest": "sha256:96dde7e1d342e99e58c12561ae4f2e873ad6cc717a2a87778b36f578f6e0bd01",
  "live_call_receipt_ref": "r7e9c36c81f43a595ee5976a185a24cb98ebe2c8c5a63881a411b74edf7c41a7b",
  "provider": "anthropic",
  "requested_model": "claude-haiku-4-5-20251001",
  "returned_model": "claude-haiku-4-5-20251001",
  "provider_request_id": "req_011CdCMh56jCehQxJjzu9VJr",
  "attempt": 1,
  "retry_count": 0,
  "status": "succeeded",
  "failure_reason": null,
  "input_tokens": 240,
  "output_tokens": 15,
  "cached_tokens": 0,
  "cache_creation_tokens": 0,
  "reserved_usd": 0.01,
  "settled_usd": 0.01,
  "pricing_version": "anthropic-official-2026-07-19-post-intro",
  "retention_status": "STANDARD_UP_TO_30_DAYS",
  "output_contract": "provider-smoke-echo",
  "output_artifact_digest": "sha256:96dc60c8799c32fb2e00fbf908bdf4ad8aa196277c420f4e7ae1823d8b04c2d9",
  "started_at": "2026-07-20T00:24:21.409Z"
}
